title,description,content
Adani hit with investigation by Indian regulators as shares tumble again,Securities and Exchange Board of India probes fraud allegations from Hindenburg Research as conglomerate tries to weather stormThe beleaguered conglomerate Adani Group is facing an investigation by Indian regulators into fraud allegations made by the US inves…,"The beleaguered conglomerate Adani Group is facing an investigation by Indian regulators into fraud allegations made by the US investor Hindenburg Research, as a brief reprieve in pressure on its sha… [+3027 chars]"
RRR star Ram Charan talks about the movie's Oscar nomination,"For decades, Indian cinema has been something of a meme to the Western world. Whether it was the elaborate dance numbers- which feel atavistic to most modern film fans- or the fantastical action sequences that make Fast and Furious movies look plausible, Indi…","For decades, Indian cinema has been something of a meme to the Western world. Whether it was the elaborate dance numbers- which feel atavistic to most modern film fans- or the fantastical action sequ… [+922 chars]"
"Indian buyers for Russia's oil are drowning in price-cap paperwork and that could hit Moscow's sales, report says","Indian buyers of Russian crude oil are drowning in paperwork demanded under the G7 price cap, and that could dent Moscow's sales, Bloomberg reported.","Indian buyers for Russia's oil are drowning in sanctions-related paperwork, and that means Moscow's crude sales could take a hit, Bloomberg has reported. 
Refiners in India now have to present docum… [+1709 chars]"
Adani's billionaire founder is reportedly looking at governance changes following scathing short-seller report that sent the Indian conglomerate's stock plunging,"Guatam Adani is considering oversight changes related to the private family companies that control his empire, the Financial Times reported.","Indian industrialist Gautam Adani is working on improving oversight of the companies that control his business empire, the Financial Times reported Tuesday, with his potential moves coming after last… [+1440 chars]"
"Adani reportedly abandons plans for an $850 million coal plant buyout, as the conglomerate still reels from a stock-market rout sparked by Hindenburg",This comes in the wake of US short seller Hindenburg Research's report that triggered a rout in Adani Group stocks.,"The embattled Adani Group has scrapped its plans to buy a coal plant in central India for $850 million, according to a report by Bloomberg, as the conglomerate reels from a scathing short-seller repo… [+1161 chars]"
OnePlus Ace 2V is a new mid-range phone that packs in a flagship chipset,"OnePlus has another mid-range device next to the OnePlus Ace 2, starting at CNY 2299 (~$330).",<ul><li>OnePlus Ace 2V sees its launch in China.</li><li>The new mid-range handset from OnePlus starts at CNY 2299 (~$330).</li><li>It is powered by Dimensity 9000 and equips a 5000mAh battery.</li><… [+2202 chars]
"Russia will keep selling cheap oil at bumped-up levels to India - this is why they're both in it for the long haul, a top analyst explains","""The interaction between these two countries will be much longer than the naysayers might assume, because there's a mutual interest in having it longer,"" Kpler analyst Viktor Katona told Insider.","Russia's bumped-up oil exports to India are here to stay as the two are building a long-term relationship based on cheap prices, according to a top Kpler analyst.
The shift in flows of Moscow's crud… [+4112 chars]"
We don’t need discount vouchers for International Women’s Day. We need equal rights | Nilanjana Bhowmick,"International Women’s Day is too often dumbed down into a mere marketing opportunity that capitalises feminismBrands wanting to “appreciate” women are offering discounts on clothes and makeup, and celebrities are urging women to use the day to pamper themselv…","Brands wanting to appreciate women are offering discounts on clothes and makeup, and celebrities are urging women to use the day to pamper themselves. In India, International Womens Day has been capt… [+5312 chars]"
India is a big global player – but there are problems it must tackle | Nouriel Roubini,"Now Modi’s government has modernised it must make growth sustainable, inclusive and fairIndia is poised to become the world’s most important country in the medium term. It has the largest population (which is still growing), and with a per-capita GDP that is …","India is poised to become the worlds most important country in the medium term. It has the largest population (which is still growing), and with a per-capita GDP that is just one-quarter that of Chin… [+6849 chars]"
This Airline Was Neck-Deep in Debt. It’s Now Breaking Aviation History With $100B Deals.,The historic Air India deal was preceded by “secret” discussions for over a year.,"An Indian airline that was neck-deep in debt for decades made a dramatic comeback this week, announcing two back-to-back billion-dollar deals that are shaking the $2.7 trillion global aviation indust… [+4601 chars]"
"Uber, Ola, Rapido: Jobs at risk as Delhi bans motorbike taxis",The Delhi government has asked ride-sharing apps to halt motorbike taxi services over licensing issues.,"India's capital Delhi has banned motorbike taxis from its roads, dealing a blow to companies such as Uber, Ola and Rapido.
A government notice says that using private two-wheelers to carry passenger… [+1715 chars]"
Michelle Yeoh's Oscar nom: Hollywood's Asian moment?,"If the Asian superstar makes history by winning an Oscar, Hollywood has much more to gain.","Just after Everything Everywhere All At Once had swept the Screen Actors Guild Awards, 94-year-old James Hong recalled a time when Hollywood saw Asian actors as ""not box office"". 
""But look at us no… [+5886 chars]"
"Rich in every sense: how Ashleigh Gardner landed a $558,000 cricket deal | Annesha Ghosh","Those who know her best say the Australian is perfectly built for T20 cricket and has every facet of the short format of the game covered offFun, fearlessness and first-rate talent can often be a winning combination, and in world No 1 allrounder Ashleigh Gard…","Fun, fearlessness and first-rate talent can often be a winning combination, and in world No 1 allrounder Ashleigh Gardner, cricket has a fine example. A three-time World Cup winner, Commonwealth Game… [+6335 chars]"
Android’s new OEM rules in India swap “requirements” with “revenue sharing”,"Just like the EU, if Google can't require OEMs to bundle apps, it'll just pay them.","Enlarge/ Let's see, you landed on my ""Google Ads"" space, and with three houses... that will be $1,400. 
0 with 
Google is being forced to revamp how it licenses Android in yet another country: Indi… [+4347 chars]"
The Vivo V27 Pro is coming after last year's flagship Android phones,"Vivo unveiled the V27 series today, featuring MediaTek's Dimensity 8200 and 7200 SoCs for the Pro and regular versions, respectively.","<ul><li>Vivo today announced its latest mid-range series of phones, boasting plenty of camera smarts and imaging capabilities.</li><li>The Vivo V27 Pro is powered by MediaTek's 4nm-based Dimensity 82… [+3394 chars]"
UK’s drive-throughs step up a gear as posh brands take to the road,"Bakery chain Gail’s is latest high-street chain hoping to serve its food through car windowsIt usually conjures images of Big Macs and fries, but drive-through dining is undergoing an upmarket makeover complete with sourdough sandwiches and street food as dem…","It usually conjures images of Big Macs and fries, but drive-through dining is undergoing an upmarket makeover complete with sourdough sandwiches and street food as demand for meals on wheels accelera… [+6664 chars]"
Head Over To 2023’s Top Location for Software Outsourcing Services,"As businesses become more aware of reducing development costs and shortening product time-to-market, software outsourcing services have emerged as a global trend. Businesses that want to accomplish their technological goals and larger business objectives don’…","As businesses become more aware of reducing development costs and shortening product time-to-market, software outsourcing services have emerged as a global trend.
Businesses that want to accomplish … [+14227 chars]"
Is India’s boom helping the poor?,What vehicle sales reveal about the country’s growth,"In a land where labour is cheap, the man who drives the most luxury cars is not a billionaire. He is a parking attendant. On a meagre salary, he must park, double-park and triple-park cars in tight s… [+3731 chars]"
TikTok-owner ByteDance planning to layoff thousands in coming months,"ByteDance, one of the biggest tech companies in China is planning to lay off at least 10,000 people this year. The company faces many challenges, like an economic slowdown, unviable projects that became too expensive etc. They even had to cancel their IPO.","It seems that big tech companies based out of China will finally start facing the music of global tech layoffs. ByteDance, the owner of TikTok and one of the biggest tech companies in China is report… [+4221 chars]"
Ukraine war: Nigeria student has 'no option but to return to study',"With online medical degrees not recognised in Nigeria, students want to return to Ukraine.","Meandering through the bustling traffic in Nigeria's main city, Lagos, Oyewumi Azeez Olawale makes his way to a visa appointment.
Just a year ago, the Nigerian medical student was scrambling to find… [+8098 chars]"
Akshata Murty held shares in collapsed firm that had near £300k ‘Sunak’ taxpayer loan,"Employees and Lloyds Bank among creditors, after liquidation of firm that benefited from pandemic aid devised by husbandRishi Sunak’s wife, Akshata Murty, invested in a furniture firm that received nearly £300,000 in taxpayer-funded loans handed out under pol…","Rishi Sunaks wife, Akshata Murty, invested in a furniture firm that received nearly £300,000 in taxpayer-funded loans handed out under policies he put in place while chancellor.
The New Craftsmen, w… [+4764 chars]"
OnePlus 11R hands-on review,The OnePlus 11R is the latest in the company's range of streamlined flagship phones for the Indian market. These devices essentially try to capture the...,"Introduction
The OnePlus 11R is the latest in the company's range of streamlined flagship phones for the Indian market. These devices essentially try to capture the essence of a flagship device but … [+2291 chars]"
High-skilled visa holders at risk of deportation amid tech layoffs,"Many of the tech firms that lobbied for more temporary visas for high-skilled immigrants are now firing these workers, leaving them with 60 days to find a new job or leave the country.","Comment on this story
LOS ANGELES The massive crush of layoffs washing through the United States tech sector is sparking panic among large numbers of immigrants, who are scrambling to stay employed … [+9268 chars]"
Electronics market shows US-China decoupling will hike inflation and slow growth,"Singapore's central bank has a gloomy vision of the future
According to the Monetary Authority of Singapore (MAS), trade barriers between US and China have resulted in geoeconomic fragmentation and will likely result in slower global growth and higher inflati…","According to the Monetary Authority of Singapore (MAS), trade barriers between US and China have resulted in geoeconomic fragmentation and will likely result in slower global growth and higher inflat… [+2107 chars]"
Android phones in this country could be very different from global markets,"The changes include only one pre-installed Google app, a search engine choice screen on setup, and more.",<ul><li>A tipster has outlined how Indian Android devices could differ from global markets.</li><li>Smartphone makers would apparently only need to install the Play Store.</li><li>Phones in India cou… [+1667 chars]
Seychelles: The island paradise held prisoner by heroin,The BBC goes inside a Seychelles' jail to see the sharp end of a problem threatening the country.,"Some 10% of the local population in the tropical island nation of Seychelles is dependent on heroin in what is now an epidemic, according to the country's government. Even being locked away offers no… [+9811 chars]"
Tuesday Morning says it wants to close 265 stores as part of its bankruptcy filing. See if your local store is on the list.,Tuesday Morning is offering to close 265 stores as part of its Chapter 11 bankruptcy. It's the second time in three years the chain has closed stores.,"Home goods store Tuesday Morning is planning its second wave of store closures in three years.
The chain filed for Chapter 11 bankruptcy on Tuesday. As part of the process, the retailer wants to clo… [+18368 chars]"
India's IT minister denies targeting Chinese apps for bans,"PLUS: Toshiba acknowledges buyout bid; BTS member Jungkook's hat lands online seller in strife; and more
Asia In Brief India's minister for electronics and information technology Rajeev Chandrasekhar has insisted that the nation does not target Chinese apps f…","Asia In Brief India's minister for electronics and information technology Rajeev Chandrasekhar has insisted that the nation does not target Chinese apps for law enforcement action or bans.
""The Mini… [+7346 chars]"
Valuations of Indian market are pricey not expensive: Vikas Pershad,"If I look at what could be the class of maybe 2024 or class of 2025 IPOs, the companies that we are looking at today are very exciting and there is a high probability that we allocate capital there.","""Our allocation to new private companies in 2022 was zero and this year however we are making progress, we are doing diligence,"" says Vikas Pershad, M&amp;G Investments.I am going to now jump from IT… [+9607 chars]"
Longer hours to test market and traders,The proposal to stretch trade timings emanates from the belief that Indian exchanges are increasingly being left behind in the global race to attract big volumes and liquidity because of the shorter trading hours.,"Mumbai: Stock traders tend to be a jumpy lot. Their moods swing as wildly as the spikes and dips in the market. In the months ahead, these traders may have to brace for longer bouts of euphoria and d… [+4210 chars]"
Modi’s model is at last revealed for what it is: violent Hindu nationalism underwritten by big business | Arundhati Roy,India’s prime minister and the billionaire Gautam Adani each benefited from the other’s rise – now their relationship is under scrutinyIndia is under attack by foreign powers. Specifically the United Kingdom and the United States. Or so our government would h…,India is under attack by foreign powers. Specifically the United Kingdom and the United States. Or so our government would have us believe. Why? Because former colonialists and neo-imperialists canno… [+13998 chars]
"Overseas air travel: Indian carriers soar, market share higher than pre-Covid level","Of the total of 1.45 crore passengers who flew into or out of India in October-December last year, Indian Airlines carried 63.06 lakh passengers.","With international air travel to and from India on a path of swift recovery, Indian carriers are cashing in, expanding their collective market share by passengers to a seven-year high, shows an analy… [+4562 chars]"
Signal: If UK Government Undermines Encryption It Can Kiss Messaging Service Used By Its Employees Goodbye,"If anyone can call a government’s bluff, it’s Signal. It’s a nonprofit, which means it doesn’t need to make a bunch of shareholders happy by capitulating to ridiculous government demands in order to retain market share. Governments really can’t threaten Signa…","from the better-start-writing-up-the-carve-outs dept
If anyone can call a government’s bluff, it’s Signal. It’s a nonprofit, which means it doesn’t need to make a bunch of shareholders happy by capi… [+4742 chars]"
India’s Adani tries to pacify investors as watchdog probes report,Adani Group's seven listed stocks have together lost about $120bn in market value since US short-seller raised concerns.,"Adani Group sought to reassure investors on Monday, saying it had strong cashflows and its business plans were fully funded, as an Indian regulator confirmed it was investigating a critical report by… [+5209 chars]"
India has identified a supplier of toxic ingredients linked to cough syrup deaths,The Indian government has made progress in its investigation into the manufacturing of cough syrup products that have caused the deaths of 19 children in Uzbekistan.Read more...,"The Indian government has made progress in its investigation into the manufacturing of cough syrup products that have caused the deaths of 19 children in Uzbekistan.
Pharmaceutical manufacturers wer… [+2060 chars]"
India top court orders probe into allegations against Adani Group,Court asks market regulator to investigate possible lapses in securities law or other regulatory disclosures by group.,Indias top court has asked the market regulator to investigate any possible lapses in securities law or other regulatory disclosures by the Adani Group which has been accused of business malpractice … [+2774 chars]
"Dabur Weighs Acquisitions to Expand Across India, Southeast Asia","Dabur India Ltd., a major consumer goods maker controlled by the billionaire Burman family, is scouting for acquisitions at home and in Southeast Asia as it works to establish its presence in a new overseas market amid heated domestic competition.","Dabur India Ltd., a major consumer goods maker controlled by the billionaire Burman family, is scouting for acquisitions at home and in Southeast Asia as it works to establish its presence in a new o… [+3323 chars]"
India’s Modi asks G20 finance heads to focus on ‘most vulnerable’,"Financial viability of many countries is being threatened by unsustainable debt, Indian PM says at two-day G20 meeting.","Policymakers of the Group of 20 (G20) leading economies should focus on helping the worlds most vulnerable people, Indias Prime Minister Narendra Modi has said as top-level financial talks kick off n… [+3446 chars]"
"Motorola Moto G73 launched in India, sales begin March 16","As promised, Motorola today launched the Moto G73 in the Indian market. It comes in Midnight Blue and Lucent White colors in a single 8GB/128GB configuration. It's priced at INR18,999 ($230/€220) and will go on sale in India starting March 16 through Motorola…","As promised, Motorola today launched the Moto G73 in the Indian market. It comes in Midnight Blue and Lucent White colors in a single 8GB/128GB configuration. It's priced at INR18,999 ($230/220) and … [+900 chars]"
Poco X5 launches in India on March 14,"Early last month, the Poco X5 got official alongside the Poco X5 Pro for global markets, yet strangely only the latter has so far made it to India. That is finally about to change in the near future, however.

The 'vanilla' Poco X5 is due to join its Pro sibl…","Early last month, the Poco X5got official alongside the Poco X5 Pro for global markets, yet strangely only the latter has so far made it to India. That is finally about to change in the near future, … [+1105 chars]"
MIUI 14's tailored Indian version to launch on February 27,"The MIUI 14 introduced by Xiaomi last December in China has already been rolled out in a few countries for Xiaomi and Poco smartphones, including India. However, Xiaomi's Indian branch has announced that the company's latest custom Android skin will get an of…","The MIUI 14 introduced by Xiaomi last December in China has already been rolled out in a few countries for Xiaomi and Poco smartphones, including India. However, Xiaomi's Indian branch has announced … [+813 chars]"
Ashutosh Varshney writes: What government-Adani relationship says about Indian capitalism,"Unlike 'national champions' of South Korea, Adani group is in sectors which are not internationally competitive. There is little it can sell on the world market that helps New Delhi.","For perspective, the Adani saga requires a comparative and historical exploration. The key question is: What do we know about the government-business nexus in the evolution of capitalism? How is cont… [+6860 chars]"
The decline of Michelin-starred restaurants,"That is the topic of my latest Bloomberg column, here is one bit: And then there is the spread of the Michelin brand. There are now Michelin guides for many US cities, which has caused the brand to lose some exclusivity. Michelin has awarded stars to 24 resta…","And then there is the spread of the Michelin brand. There are now Michelin guides for many US cities, which has caused the brand to lose some exclusivity. Michelin has awarded stars to 24 restaurants… [+1606 chars]"
Indian market will remain steady for next couple of quarters: Dinshaw Irani,​So we are looking at the right prices and the right valuation probably and frankly I mean the way India is going obviously when you are talking about capex driven economic growth you are talking about really these kind of stocks doing well. But ultimately we…,"""Even the earnings growth are pretty good. In fact till the beginning of Feb when I was keeping track of what was happening earnings growth was around 18% in the Nifty,"" says Dinshaw Irani, CIO, Heli… [+4510 chars]"
ETMarkets Smart Talk: Investors can allocate up to 5-10% in gold depending on risk profile: Pradeep Gupta,Monetary tightening both globally and in India in the last week also had a damping effect on the Indian equity market as also the rise in bond yield in the US.,"Investors can look at allocation in Gold upto 5%-10% depending on their risk profile and broad level asset allocation, says Pradeep Gupta - Co-founder &amp; Vice Chairman, Anand Rathi Group.In an int… [+6285 chars]"
ETMarkets Smart Talk: FIIs are booking profits & are looking for cheaper markets to invest in: Sumit Chanda,"The FIIs selling has nothing to do with Adani. This has everything to do with the fight against inflation, global recessionary headwinds, and the fact that at current levels, the Indian market is expensive.","We are probably the only EM that delivered positive returns last year and it is likely that the FIIs are just booking profits and looking for cheaper markets to invest in, says Sumit Chanda, CEO and … [+6577 chars]"
CR: Global smartwatch market saw 12% YoY increase in shipments for 2022,Smartwatch shipments saw a 12% increase in 2022 compared to 2021 based on the latest Global Smartwatch Model Tracker report from Counterpoint Research. The growth was fueled by strong smartwatch sales in the first three quarters of 2022. Shipments in the Q4 p…,Smartwatch shipments saw a 12% increase in 2022 compared to 2021 based on the latest Global Smartwatch Model Tracker report from Counterpoint Research. The growth was fueled by strong smartwatch sale… [+1573 chars]
Our Samsung Galaxy A14 5G video review is now up,"Samsung introduced the Galaxy A14 5G to the US market in early January, and we've had a fun time playing with it recently. This is among the least expensive Galaxies you can buy today, with its $200 recommended retail price.

It's definitely an intriguing pro…","Samsung introduced the Galaxy A14 5G to the US market in early January, and we've had a fun time playing with it recently. This is among the least expensive Galaxies you can buy today, with its $200 … [+1033 chars]"
We expect hybrid funds to probably attract more flows this year: Mahesh Patil,​It has impacted the sentiment because that could further impact growth and that is what the market is slightly worried about. But having said that I think overall at least from Indian market perspective we are not seeing any major impact on earnings growth.,"""I think we have been seeing that not only debt but the returns across asset classes are in a very narrow range whether it is debt, whether it is expectation on gold or real estate and as a result in… [+3443 chars]"
‘Adults and kids pushed each other to grab as many bottles as they could’: how the world got hopped up on energy drinks,"They are a multibillion-dollar global industry, a vital pick-me-up for gig-economy workers and – thanks to KSI and Logan Paul’s Prime – a cult among teens. But what are these sugary, often hyper-masculine brands doing to those who drink them?A 13-year-old I k…",A 13-year-old I know (whose identity I am thinly veiling to preserve his privacy) came back from school the other day and told me that there was a year 9 kid dealing Prime at the back of the class. A… [+20277 chars]
ITC’s climb to a record high shows investor hunt for stability amid Adani woes,"ITC is the best-performing stock in the NSE Nifty 50 Index with a 15% gain this year, pushing its market value to nearly $57 billion.","Shares of Indian conglomerate ITC Ltd. have climbed to a record high, demonstrating investors may be starting to focus on stability in a market churning with concerns over corporate governance.Its th… [+1861 chars]"
Olectra in partnership with Reliance unveils Hydrogen bus,This initiative will help out the Indian government to achieve carbon-free hydrogen ambitions.,"Olectra Greentech in technical partnership with Reliance on Thursday unveiled a Hydrogen Bus, which is a carbon-free alternative to traditional public transportation.Olectra Greentech Ltd (OGL), a su… [+1502 chars]"
