title,description,content
"OnePlus Pad was unveiled after years of work, it will be a gamechanger: COO Kinder Liu","In an exclusive interaction with the Indian Express, Kinder Liu, COO of OnePlus, said that the soon-to-launch OnePlus Pad tablet will be a ""game changer in the industry.""","OnePlus has made a successful entry into the IoT market in India, with its smart TVs and audio products showing impressive growth rates. The brand has recently expanded into the tablet market with th… [+8221 chars]"
"23 smallcap stocks offer double-digit weekly gains, surging up to 28% in volatile market week","Going forward, Indian equities are likely to take cues from global trends as investors weigh comments around the Federal Reserve policy and interest rate trajectory. Technically, analysts say the index has given a consolidation breakout on the daily chart, su…","As many as 23 smallcap stocks offered double digit returns in a volatile market week, with four of them retesting their respective 52-week highs, according to an analysis by Economic Times.Equity mar… [+2309 chars]"
"Infosys founder slams working from home, side hustles, as slowing India's growth","PLUS: Australia to appoint cyber-coordinator; FTX Japan resumes operations; India's PC market bucks trend with growth; and more
Asia in brief Infosys founder NR Narayana Murthy last week weighed into the debate about the propriety of tech workers moonlighting…","Asia in brief Infosys founder NR Narayana Murthy last week weighed into the debate about the propriety of tech workers moonlighting in second gigs, opining that it's not just wrong it hurts India's d… [+7937 chars]"
Tecno Spark 10C surfaces on Google Play Console with key specs,"Tecno unveiled the Spark 8C in late January for the Indian market, but it seems like the 10C is right around the corner. It appeared in a Google Play Console listing, suggesting software development is being finalized.



Google Play Console listing

Just lik…","Tecno unveiled the Spark 8C in late January for the Indian market, but it seems like the 10C is right around the corner. It appeared in a Google Play Console listing, suggesting software development … [+397 chars]"
ETMarkets Smart Talk: 4 reasons why FIIs are on the edge when it comes to Indian markets: Aniruddha Sarkar,"Firstly, the continued rate hikes in the US and US Fed commentary of further rate hikes are making risk-reward unfavourable towards emerging market equities in an environment of heightened geo-political risks.","2023 would be a challenging year for Indian equities owing to multiple factors ranging from not-so-cheap valuations to earnings downgrades to state elections in nine states, says Aniruddha Sarkar, CI… [+8355 chars]"
"Adani Cuts Growth Target, Capex in Post-Hindenburg Repair Moves","Gautam Adani’s conglomerate has halved its revenue growth target and plans to hold off fresh capital expenditure, according to people familiar with the matter, as the Indian billionaire seeks to rebuild investor confidence in the wake of a bruising short sell…","Gautam Adanis conglomerate has halved its revenue growth target and plans to hold off fresh capital expenditure, according to people familiar with the matter, as the Indian billionaire seeks to rebui… [+5775 chars]"
Moody’s maintains stable outlook on Indian banks,Moody's has maintained a stable outlook for India's banking system citing strong fundamentals of the local economy which will support credit growth and prevent deterioration in asset quality. The rating agency has however flagged loans to small and medium-siz…,Global credit rating agency Moody's has maintained a stable outlook for India's banking system citing strong fundamentals of the local economy which will support credit growth and prevent deteriorati… [+4456 chars]
"India Had Second Biggest Box Office Year Ever In 2022 With $1.28BN, But Admissions Still Down On Pre-Pandemic Levels","South Indian mega-hits like K.G.F: Chapter 2 and RRR and Disney’s Avatar: The War Of Water helped drive India’s box office to its second biggest year ever in revenue terms in 2022, but the gains are also partly attributed to rising ticket prices as overall ad…","South Indian mega-hits like K.G.F: Chapter 2 and RRR and Disney’s Avatar: The War Of Water helped drive India’s box office to its second biggest year ever in revenue terms in 2022, but the gains are … [+3794 chars]"
"Zee Studios’ Shariq Patel On Push Into Web Series, Festival Films with Berlin selections ‘Brown’ and ‘Aatma Pamphlet’","EXCLUSIVE: India’s Zee Studios, headed by CEO Shariq Patel, is starting to become a regular on the international film festival and TV market circuit.  The company recently attended the Rotterdam film festival, where it had Devashish Makhija’s Joram premiering…","EXCLUSIVE: India’s Zee Studios, headed by CEO Shariq Patel, is starting to become a regular on the international film festival and TV market circuit. 
The company recently attended the Rotterdam fil… [+5880 chars]"
India: The next chemicals manufacturing hub,India’s chemicals industry has been a global outperformer in demand growth and shareholder wealth creation for a decade.  Its strong starting point could make it the next chemicals manufacturing hub.,"Over the past few years, the Indian chemicals sector has exceeded all shareholder expectations, outperforming not just the overall equity market but also the majority of its upstream and downstream i… [+10498 chars]"
Sebi looks at links between Mauritius managers and FPIs,"On Friday, the Securities & Exchange Board of India (Sebi) circulated a list of eight entities, mostly based in Mauritius, with the custodians which are banks and non-banks acting as bookkeepers of FPIs trading on Indian stock exchanges.","Mumbai: India's capital market regulator has asked custodians to check the links between certain entities, mostly based in Mauritius, and foreign portfolio managers (FPI) trading on stock exchanges h… [+3215 chars]"
Volkswagen to Revisit India Amid China Geopolitical Uncertainty,Europe’s largest carmaker is taking a closer look at India — again.,"Europes largest carmaker is taking a closer look at India again.
Volkswagen AG wants to remain a strong player in Europe and China, but in the face of growing geopolitical tensions and an increasing… [+2910 chars]"
"Indian stocks to be flat & volatile for first 6 months of 2023, 10% Return likely in H2: Mugunthan Siva",I expect China to be the best-performing market this year purely from a valuation front. I am not a huge buyer of China reopening because reopening will altogether mean a different type of growth - more internal and consumption-focused rather than building hi…,"Investors have made money in Indian markets when the PE (price to earnings) ratio rose from 14-15 times to 20 times, said Mugunthan Siva, co-founder and managing director at Australia-based India Ave… [+3863 chars]"
"Infinix Smart 7 arrives in India with 6,000 mAh battery INR 7,299 launch price","The latest offering from Infinix is the Smart 7 – an INR 7,299 ($88) entry-level Android phone. You get a sizeable 6.6-inch LCD with HD+ resolution and a waterdrop notch for the 5MP selfie camera. The phone features a textured back with a wave pattern and an …","The latest offering from Infinix for Indian market is the Smart 7 an INR 7,299 ($88) entry-level Android phone. You get a sizeable 6.6-inch LCD with HD+ resolution and a waterdrop notch for the 5MP s… [+693 chars]"
India setting up $4 billion fund to backstop corporate debt market,"According to a regulatory official, the government will provide a credit line to ensure funds have liquidity equivalent to Rs 30,000 crore","India is setting up a fund worth Rs33000 crore ($4 billion) to provide liquidity to its corporate debt market during bouts of stress, to help stem panic selling and ease redemption pressures, an SBI … [+2206 chars]"
Adani: Indian Supreme Court opens panel into short seller allegations,An independent panel set up by India’s Supreme Court is investigating the fraud allegations against billionaire Gautam Adani’s conglomerate Adani Group. Shares of companies linked to the Adani Group have sharply fallen since U.S. short seller Hindenburg Resea…,An independent panel set up by Indias Supreme Court is investigating the fraud allegations against billionaire Gautam Adanis conglomerate Adani Group.Shares of companies linked to the Adani Group hav… [+326 chars]
Adani companies’ decent earnings offer only moderate relief,The Indian conglomerate is still reeling from a short-seller’s attack,On February 14th Adani Enterprises reported robust earnings. Its ports-to-power parent conglomerate had a solid 2022. Not solid enough to reassure investors: the Indian groups market value is down by… [+354 chars]
Indian agencies to buy red onion as prices plunge on surplus output,"Prices of the crop have fallen to as low as 200 rupees ($2.44) per 100 kilograms prompting some farmers to dump the crop in fields in the western state of Maharashtra, the largest producer of red onion in the country, where rates have fallen sharply.","The government on Tuesday said it has directed two of its agencies to ""immediately intervene"" and purchase red onion crops from the market after prices fell significantly over the last month, resulti… [+703 chars]"
‘Designs to weaken Indian democracy’: Smriti Irani hits back at billionaire George Soros for his remark on Adani row,"Union Minister Smriti Irani said George Soros' remark was a ""declaration to destroy India's democratic processes"".","Soon after billionaire investor George Soros said the Adani-Hindeburg saga would spark “a democracy revival in India”, the central government Friday rebutted his statement, saying the “designs to wea… [+1203 chars]"
ETMarkets Smart Talk: Constructive on India story but equity markets have to deal with these 3 headwinds in 2023: Niraj Kumar,"Over the past 12 months, Indian equity markets have weathered numerous adverse events like the Russia-Ukraine conflict, surging energy costs (Crude oil & Natural gas), unprecedented inflation in the developed world and consequent aggressive global monetary ti…",The foremost headwind is going to emerge from the asset allocation decision of the global money managers. With fixed income offering lucrative yields we anticipate movement of funds from Equities to … [+10707 chars]
MSCI Will Speed ESG Ratings Reviews After Silence on Adani,"One of the market’s most popular ESG index providers says it will speed up its review of companies, after it failed to address allegations of poor governance at the Adani Group companies as quickly as its competitors.","One of the markets most popular ESG index providers says it will speed up its review of companies, after it failed to address allegations of poor governance at the 
Adani Group companies as quickly … [+1726 chars]"
"In ’22, India fastest growing market for Netflix, revenue up 25%, says Sarandos","Addressing a select group of journalists, Sarandos said the company did not disclose revenue numbers separately for different countries. “India’s the fastest growing for Netflix amongst all markets we operate in. It had the highest net paid additions in 2022,…","NETFLIX Co-Chief Executive Officer Ted Sarandos Friday said India grew the fastest among all countries in the world in 2022. The global streaming company, with $5.6 billion in operating income over r… [+2645 chars]"
Nine New Reasons To Eat In Los Angeles,"LA dining is on the upswing with Indian-Mexican chicken, wagyu ramen, green curry bucatino and so much more.","The Serrano Experience serves hand-cut pata negra.
John Troxell
Los Angeles dining is on the upswing with openings, reopenings and pop-ups shaking up the scene. Heres a look at the new hotness:
Sa… [+6542 chars]"
vivo V27 Pro prices and specs leak ahead of launch,"The vivo V27 Pro is expected to be announced on March 1, and we already got a unit for a review. Now a leaked image from Flipkart reveals the pricing and memory combinations for the Indian market.

An image that was supposed to be shared next week says the vi…","The vivo V27 Pro is expected to be announced on March 1, and we already got a unit for a review. Now a leaked image from Flipkart reveals the pricing and memory combinations for the Indian market.
A… [+931 chars]"
"iQOO Z7's launch date and key specs revealed, will be priced under INR20,000","The iQOO Z7 we've been hearing about for over a week now will be launched on March 21 in India. This revelation comes from iQOO India's CEO Mr. Nipun Marya, who, in an interview with Gadgets360, also divulged a few specs of the upcoming Z-series smartphone.

…","The iQOO Z7 we've been hearing about for over a week now will be launched on March 21 in India. This revelation comes from iQOO India's CEO Mr. Nipun Marya, who, in an interview with Gadgets360, also… [+1199 chars]"
Active vs. Passive Investment Management,Investing is a personal thing that can be really rewarding if you do it right. But what does “doing it right” mean? Is there really a “right” way? And how do you even get started if you’re considering investing in a new asset class or method of investing? In …,Investing is a personal thing that can be really rewarding if you do it right. But what does “doing it right” mean? Is there really a “right” way? And how do you even get started if you’re considerin… [+9825 chars]
"Shopify’s Early Job Cuts Fuel Rebound in Earnings, Stock Price","(Bloomberg) -- Shopify Inc. was the among the first technology giants to slash its workforce during last year’s market rout. Now, some investors say its...","(Bloomberg) -- Shopify Inc. was the among the first technology giants to slash its workforce during last years market rout. Now, some investors say its stock is poised to outperform peers over the co… [+5723 chars]"
"Who is Vivek Ramaswamy: Indian-American businessman, rapper running for US President","Vivek Ramaswamy is the second Indian-American to enter the Republican presidential primary race, after Nikki Haley, former US ambassador to the UN.",Indian-American tech entrepreneur Vivek Ramaswamy on Wednesday (February 22) announced that he will contest the 2024 presidential election in the United States. He is the second Indian-American to en… [+3017 chars]
Foreign investors are being snagged by India’s tax net,Indian startups will suffer,"StartupSin India, as elsewhere, are in trouble. Venture-capital (VC) investments in January were down by 80%, year on year, according to Inc42, an online publication. Many of the reasons are familiar… [+3721 chars]"
India’s financial sector regulators are seized of the matter: FM,"A three-judge bench, headed by Chief Justice of India D Y Chandrachud, on Friday had pointed out that the stock market has seen the rising presence of the middle-class and there was a need, therefore, to scale up security measures in tune with India’s changin…","Amid concerns over the ongoing controversy related to the Adani group, Union Finance Minister Nirmala Sitharaman on Saturday said the country’s financial sector regulators are seized of the matter an… [+2468 chars]"
Japan to chair G7 talks on pressuring Russia over Ukraine,Financial leaders of the G7 will meet on Thursday to discuss measures aimed at pressuring Moscow to end war.,"Financial leaders of the G7 will meet on Thursday to discuss measures to pressure Russia to end the Ukraine war, Japans Finance Minister Shunichi Suzuki has said.
Japan will chair the meeting of fin… [+1572 chars]"
Diamond units cut capacity by 40%,"""We do not know how the geopolitical tension will pan out in the coming days. Both the US and China are important markets for us,"" said Vipul Shah, chairman of Gem & Jewellery Export Promotion Council (GJEPC). Tensions between the US and China flared in recen…",Fresh tensions between the US and China are adding to the anxieties of Indian diamond exporters who have reduced capacity utilisation of their cutting and polishing units by 40% due to a slowdown in … [+1141 chars]
"No major risk to banks from Adani crisis, says S&P exec","However, Dangra also pointed at a number of factors to suggest the crisis doesn't seem to cause meaningful contagion risk to the Indian financial system directly. Based on external estimates, the banking system's exposure to Adani Group is less than 1%, he sa…","New Delhi: There are no significant, direct spill-over risks to the broader banking system from the crisis at Adani Group but some secondary aspects may come into play, a senior executive with global… [+1937 chars]"
"Bourses identify 15 brokers as QSBs, monitoring to begin July 1","Anand Rathi Share and Stock Brokers, 5Paisa Capital, Angel One, HDFC Securities, and ICICI Securities are part of the list, which is not indicative of rankings or size.","Mumbai: Indian stock and commodity exchanges have identified and categorised 15 stockbrokers as Qualified Stock Brokers (QSBs).According to a joint statement by the exchanges, the monitoring of such … [+924 chars]"
"Netflix Shelves Indian Film ‘Tees’, Director Dibakar Banerjee Seeks New Buyer","EXCLUSIVE: Indian director Dibakar Banerjee’s Tees has been shelved by Netflix and the auteur is now seeking a new home for the feature. Netflix confirmed it has no plans to release the feature, but has not commented on the reasons for shelving it.  Tees was …","EXCLUSIVE: Indian director Dibakar Banerjee’s Tees has been shelved by Netflix and the auteur is now seeking a new home for the feature.
Netflix confirmed it has no plans to release the feature, but… [+4337 chars]"
Every downturn a boon for Indian software companies: Narayana Murthy,"I think every downturn is actually a boom for Indian software companies except some extraordinary events like 2008 when the banking sector went down very badly and that was a reasonably large sector for large Indian software companies like TCS, Infosys etc. B…","""In my belief India is a large country, it produces a large number of engineers. And right in 1980 before I founded Infosys, I realised that our charter has to be to create a large number of jobs for… [+7701 chars]"
"We are well positioned to create value added solutions for our clients: Sreekanth Nadella, KFin",Equity AUM overall market share of KFin Tech is about 35%. Getting to 40% will definitely take some time. KFin's contribution of equity AUM to the total share of AUM continues to be an impressive 56% of the total book that we manage at this point in time,"""Our margins in terms of PAT stands at about 25 plus percent for the nine months ending 31st December. The margin expansion is largely contributed both by EBITDA growth as well as retirement of debt … [+4247 chars]"
Air India’s order unpacked,"The significance of the biggest order for passenger aircraft in history goes far beyond Air India and Indian aviation — it has the potential to boost flagging Western economies, and sends a vital diplomatic message at a time of Western sanctions against Russi…","Tata Group-owned Air India (AI) placed two mega orders on Tuesday, adding up to a staggering 470 aircraft for 250 planes with Europes Airbus consortium, and 220 with Boeing Co. of the United States. … [+9365 chars]"
Modi ally says BJP has ‘nothing to hide’ amid Adani controversy,India's home minister Amit Shah makes comments after ruling party accused of favouritism towards embattled conglomerate.,"Indian Prime Minister Narendra Modis party has nothing to hide or be afraid of on the controversy over the Adani group, the home minister has said, responding to opposition allegations of favouring t… [+1345 chars]"
Sell-off in Indian markets providing good entry point for foreign investors: Mugunthan Siva,"I think it is a mix, so the way we look at India is we know that we cannot pick Indian stocks sitting in Australia. So what we do is as a process, we tend to hire locally based investment managers as our advisors.","""I would say this global slowdown or recession that might be imminent is going to pause India's recovery to some degree and that is a bit of a pity because I feel that when we talk to the businesses,… [+9325 chars]"
‘Sign of deep trust’: Israel ambassador Naor Gilon on Adani’s Haifa port takeover,"Last month Adani Group competed with Chinese and Turkish firms to acquire the strategic Israeli port, one of the largest in the eastern Mediterranean, for $1.2 billion.","Referring to Adani Groups recent takeover of the Haifa port in Israel, the countrys ambassador to India, Naor Gilon, said Wednesday that it was a sign of deep trust in the hands of an Indian company.… [+1714 chars]"
"Hot Stocks: Brokerages view on steel stocks, Apollo Hospitals, PB Fintech, Biocon and others","JP Morgan on Tata Steel and SAIL said, ""Investor sentiment remains bearish on metals, lacking a meaningful demand recovery in China. Either steel prices need a rally or coking coal prices need to fall. Indian steel mills are well positioned"".",Global brokerage firm JPMorgan has intiated an overweight stance on both steel stocks - Tata Steel and SAIL. Citi has issued a buy rating on SAIL as it expects pricing and margin resilience on China'… [+2590 chars]
Study Abroad: How online money transfer services are easing up students’ KYC compliance process,"When one heads out to study abroad, international money transferring is a huge issue that not many Indian students are not very familiar with. Check expert advice on foreign money transfer","Sending and receiving money overseas from India has never been simple. Even with the rise of digital banking, rigorous Know Your Customer (KYC) compliance procedures, where customers have to visit th… [+3446 chars]"
Gautam Adani’s Older Brother Emerges As Family Empire’s Key Fixer,"Vinod Adani, the longtime Indian expat, is at the heart of the Adani Group’s global web of subsidiaries and offshore shareholders. Just don’t call him a related party.","Vinod Adani, the longtime Indian expat, is at the heart of the Adani Groups global web of subsidiaries and offshore shareholders. Just dont call him a related party.
Gautam Adani, the 60-year-old In… [+11816 chars]"
"Onion exports speed up, demand from Gulf countries heats up markets","Exports account for around 10-15 per cent of the total onion produced in the country, with Maharashtra, Karnataka and Gujarat being the leaders.","After plateauing for two years, onion exports have accelerated thanks to the demand from West Asia. In the 2022-23 fiscal, India has so far exported 15.19 lakh tonnes of the bulb, as compared to the … [+1989 chars]"
"Indian gas consumption likely to peak by 2037-2040: Sanjay Kumar, IGL","We have increased our volume slightly over 8.1, that is the average that we had reported last quarter. Presently, we are clocking about 8.25 to 8.3 million cubic meter per day of volume.","""Once we commission these steel lines, we will see a lot of growth in new areas like Kanpur, Muzaffarnagar, then in Rajasthan, Ajmer and Haryana. So we plan that we will have one million cubic meter … [+5493 chars]"
Can technology clean up the shrimp farming business?,Shrimp farming has been criticised for causing environmental damage - can tech clean it up?,"For generations the family of Debabrata Khuntia made a living by fishing in the Bay of Bengal and the rivers and canals of Purba Medinipur in West Bengal.
He remembers being able to catch 10 tonnes … [+5909 chars]"
Ride out these tough times and wait for interest rates to settle down: Dipan Mehta,​So we just need to ride out these tough times and wait for interest rates to settle down and then perhaps start declining and that is where the trigger will come and you will see inflection point and the market turnaround from these sideways or to slightly b…,"""Yes in a way these two correlations are a bit difficult to really get a handle on. As I said, I think the bigger issue is not the slowdown from the Indian stocks perspective as much it is the intere… [+6063 chars]"
